{
  "$schema": "https://json-schema.org/draft/2020-12/schema",
  "title": "SootheSpot External Resource",
  "type": "object",
  "required": ["id","name","publisher","resource_type","official_url","description","tags","access","review_status","last_verified_at"],
  "properties": {
    "id": {"type": "string"},
    "name": {"type": "string"},
    "publisher": {"type": "string"},
    "resource_type": {"type": "string"},
    "official_url": {"type": "string", "format": "uri"},
    "platforms": {"type": "array", "items": {"type": "string"}},
    "description": {"type": "string"},
    "tags": {"type": "array", "items": {"type": "string"}},
    "intended_population": {"type": "array", "items": {"type": "string"}},
    "use_context": {"type": "array", "items": {"type": "string"}},
    "languages": {"type": "array", "items": {"type": "string"}},
    "locales": {"type": "array", "items": {"type": "string"}},
    "regions": {"type": "array", "items": {"type": "string"}},
    "publisher_region": {"type": "string"},
    "availability_regions": {"type": "array", "items": {"type": "string"}},
    "cultural_context": {
      "type": "object",
      "properties": {
        "adaptation_status": {"enum": ["unknown","translated","localized","culturally_adapted","community_informed"]},
        "notes": {"type": "string"},
        "source_notes": {"type": "array", "items": {"type": "string"}}
      },
      "additionalProperties": false
    },
    "accessibility": {"type": "array", "items": {"type": "string"}},
    "privacy_notes": {"type": "string"},
    "data_practices_url": {"type": "string", "format": "uri"},
    "access": {"type": "array", "items": {"type": "string"}},
    "evidence_notes": {"type": "string"},
    "limitations": {"type": "string"},
    "review_status": {"enum": ["unreviewed","screened","clinically_reviewed","verified","deprecated"]},
    "last_verified_at": {"type": "string", "format": "date"},
    "source_notes": {"type": "array", "items": {"type": "string"}},
    "license_notes": {"type": "string"},
    "duration_options_minutes": {"type": "array", "items": {"type": "number", "minimum": 0}},
    "isbn": {"type": "string"},
    "authors": {"type": "array", "items": {"type": "string"}},
    "publication_year": {"type": "integer", "minimum": 0},
    "page_count": {"type": "integer", "minimum": 1},
    "shelf": {"type": "string"},
    "needs": {"type": "array", "items": {"type": "string"}}
  }
}