[
  {
    "id": "nimh-jane-the-brain",
    "name": "Jane the Brain Video Series",
    "publisher": "National Institute of Mental Health",
    "resource_type": "video-series",
    "official_url": "https://www.nimh.nih.gov/get-involved/science-education/video-series-jane-the-brain",
    "platforms": ["Web", "Video"],
    "description": "An NIMH educational video series that helps children understand stress, frustration, sadness, and coping skills.",
    "tags": ["stress", "frustration", "sadness", "coping", "youth", "video", "understand"],
    "intended_population": ["children", "students", "families", "educators"],
    "use_context": ["psychoeducation", "independent-use", "family-supported"],
    "languages": ["English"],
    "access": ["free"],
    "duration_options_minutes": [3, 4, 5],
    "accessibility": ["audio-description"],
    "regions": ["United States"],
    "publisher_region": "United States",
    "availability_regions": ["United States", "Web"],
    "cultural_context": {"adaptation_status": "unknown", "notes": "NIMH educational content. No cultural adaptation claim is inferred from the source."},
    "evidence_notes": "Official NIMH educational series; it is educational content rather than individualized clinical care.",
    "limitations": "Designed for children and educational contexts; not an individualized assessment or treatment.",
    "review_status": "verified",
    "last_verified_at": "2026-10-02",
    "source_notes": ["https://www.nimh.nih.gov/get-involved/science-education/video-series-jane-the-brain"],
    "license_notes": "External resource. SootheSpot stores metadata only."
  },
  {
    "id": "samhsa-stress-management-breathing-video",
    "name": "Stress Management Techniques, Healthy Coping Strategies, Breathing Exercise",
    "publisher": "Substance Abuse and Mental Health Services Administration",
    "resource_type": "video",
    "official_url": "https://www.samhsa.gov/resource/dbhis/stress-management-techniques-healthy-coping-strategies-breathing-exercise",
    "platforms": ["Web", "Video"],
    "description": "An 8-minute SAMHSA video covering stress management, self-care, and a demonstrated breathing exercise.",
    "tags": ["stress", "coping", "self-care", "breathing", "video", "practice"],
    "intended_population": ["general", "disaster-survivors", "crisis-counselors"],
    "use_context": ["independent-use", "professional-training"],
    "languages": ["English"],
    "access": ["free"],
    "duration_options_minutes": [8],
    "accessibility": ["video"],
    "regions": ["United States"],
    "publisher_region": "United States",
    "availability_regions": ["United States", "Web"],
    "cultural_context": {"adaptation_status": "unknown", "notes": "SAMHSA source; no cultural adaptation claim is inferred."},
    "evidence_notes": "Official SAMHSA educational resource published for stress management and self-care.",
    "limitations": "Originally developed for crisis counselors and disaster-survivor contexts, so examples may not fit every everyday situation.",
    "review_status": "verified",
    "last_verified_at": "2026-10-02",
    "source_notes": ["https://www.samhsa.gov/resource/dbhis/stress-management-techniques-healthy-coping-strategies-breathing-exercise"],
    "license_notes": "External resource. SootheSpot stores metadata only."
  }
]
